{
  "kind": "frameshift.inspection",
  "schemaVersion": 1,
  "engineVersion": "@ENGINE_VERSION@",
  "files": {
    "complete": true,
    "stop": null,
    "admitted": 14,
    "admittedBytes": 1680,
    "directories": 11,
    "ignored": {
      "vcs": 0,
      "dependencies": 0,
      "build-output": 0,
      "environment": 0,
      "gitignore": 0
    },
    "oversized": 0,
    "links": 0,
    "reparsePoints": 0,
    "special": 0,
    "notTraversed": 0,
    "uninspectable": 0,
    "unrepresentable": 0
  },
  "packageManager": {
    "name": "npm",
    "source": "package-manager-field",
    "declared": {
      "name": "npm",
      "version": "11.11.0"
    },
    "lockfile": {
      "path": "package-lock.json",
      "status": "parsed",
      "formatVersion": 3
    },
    "ignoredLockfiles": [
      {
        "path": "yarn.lock",
        "reason": "other-manager"
      }
    ]
  },
  "workspace": {
    "isWorkspace": true,
    "declarations": [
      "package.json"
    ],
    "releases": [
      "npm-11"
    ],
    "complete": true,
    "members": [
      "packages/copy",
      "packages/ui"
    ],
    "undetermined": []
  },
  "packages": [
    {
      "directory": ".",
      "name": "fictional-conflict",
      "manifest": "analyzed",
      "nextjs": {
        "verdict": "nextjs",
        "dependency": {
          "field": "dependencies",
          "specifier": "^15.1.0"
        },
        "version": {
          "value": "15.1.3",
          "evidence": "locked"
        },
        "config": {
          "path": "next.config.js",
          "load": "loaded"
        },
        "router": "hybrid",
        "app": {
          "path": "app",
          "inSrc": false,
          "state": "directory",
          "routeFiles": 1,
          "complete": true
        },
        "pages": {
          "path": "src/pages",
          "inSrc": true,
          "state": "directory",
          "routeFiles": 1,
          "complete": true
        }
      }
    },
    {
      "directory": "packages/copy",
      "name": "fictional-ui",
      "manifest": "analyzed",
      "nextjs": {
        "verdict": "absent",
        "dependency": null,
        "version": null,
        "config": {
          "path": "next.config.js",
          "load": "loaded"
        },
        "router": "none",
        "app": null,
        "pages": null
      }
    },
    {
      "directory": "packages/ui",
      "name": "fictional-ui",
      "manifest": "analyzed",
      "nextjs": {
        "verdict": "nextjs",
        "dependency": {
          "field": "dependencies",
          "specifier": "^15.1.0"
        },
        "version": {
          "value": "15.1.3",
          "evidence": "locked"
        },
        "config": {
          "path": "next.config.js",
          "load": "loaded"
        },
        "router": "pages",
        "app": null,
        "pages": {
          "path": "packages/ui/pages",
          "inSrc": false,
          "state": "directory",
          "routeFiles": 1,
          "complete": true
        }
      }
    }
  ],
  "migrationPaths": [],
  "findings": [
    {
      "id": "F0001",
      "code": "FS1044",
      "severity": "review",
      "location": {
        "scope": "file",
        "path": "app"
      },
      "message": "Next.js router directory not fully known",
      "explanation": "app and pages lie in different directories, which Next.js 15 and later reject.",
      "remediation": "Move app and pages into the same directory."
    },
    {
      "id": "F0002",
      "code": "FS1033",
      "severity": "review",
      "location": {
        "scope": "file",
        "path": "package.json"
      },
      "message": "Workspace members depend on case sensitivity",
      "explanation": "The workspace patterns select other directories when names are compared without case, as on the default file systems of Windows and macOS. Frameshift compares names case-sensitively.",
      "remediation": "Spell the patterns with the exact case of the directory names."
    },
    {
      "id": "F0003",
      "code": "FS1021",
      "severity": "review",
      "location": {
        "scope": "text",
        "path": "package.json",
        "start": {
          "offset": 154,
          "line": 7,
          "column": 5
        },
        "end": {
          "offset": 160,
          "line": 7,
          "column": 11
        }
      },
      "message": "Duplicate key in a package file",
      "explanation": "The key occurs again later in the same object. Frameshift uses the last occurrence, as npm does, but other tools may read the file differently.",
      "remediation": "Remove the duplicate key."
    },
    {
      "id": "F0004",
      "code": "FS1035",
      "severity": "review",
      "location": {
        "scope": "file",
        "path": "packages/ui"
      },
      "message": "Package manager rejects the workspace",
      "explanation": "Two workspace members have the same name, which this package manager rejects. This holds for npm 11.",
      "remediation": "Correct the workspace so that the package manager installs it, then run Frameshift again."
    },
    {
      "id": "F0005",
      "code": "FS1023",
      "severity": "review",
      "location": {
        "scope": "file",
        "path": "yarn.lock"
      },
      "message": "Lockfile of another package manager ignored",
      "explanation": "The packageManager field names a different package manager, so this lockfile is not used.",
      "remediation": "Remove the stale lockfile, or correct the packageManager field."
    },
    {
      "id": "F0006",
      "code": "FS1045",
      "severity": "info",
      "location": {
        "scope": "file",
        "path": "next.config.mjs"
      },
      "message": "Next.js ignores this file or directory",
      "explanation": "Next.js loads only the first configuration file that it finds, in the order next.config.js, next.config.mjs, and from Next.js 15 next.config.ts and from 16 next.config.mts, and ignores every other configuration file beside the one it loads.",
      "remediation": "Merge the settings into the configuration file that Next.js loads, and remove this one."
    },
    {
      "id": "F0007",
      "code": "FS1045",
      "severity": "info",
      "location": {
        "scope": "file",
        "path": "next.config.ts"
      },
      "message": "Next.js ignores this file or directory",
      "explanation": "Next.js loads only the first configuration file that it finds, in the order next.config.js, next.config.mjs, and from Next.js 15 next.config.ts and from 16 next.config.mts, and ignores every other configuration file beside the one it loads.",
      "remediation": "Merge the settings into the configuration file that Next.js loads, and remove this one."
    },
    {
      "id": "F0008",
      "code": "FS1045",
      "severity": "info",
      "location": {
        "scope": "file",
        "path": "packages/ui/next.config.js"
      },
      "message": "Next.js ignores this file or directory",
      "explanation": "Next.js looks only for regular files with a configuration file name, so it ignores this entry, which is not a file.",
      "remediation": "Rename the entry, so that its name does not suggest a configuration file."
    },
    {
      "id": "F0009",
      "code": "FS1045",
      "severity": "info",
      "location": {
        "scope": "file",
        "path": "src/app"
      },
      "message": "Next.js ignores this file or directory",
      "explanation": "Next.js uses the app or pages directory of the package directory and ignores the one with the same name below src.",
      "remediation": "Move the routes into the directory that Next.js uses, and remove this one."
    }
  ]
}
