{
  "kind": "frameshift.inspection",
  "schemaVersion": 1,
  "engineVersion": "@ENGINE_VERSION@",
  "files": {
    "complete": true,
    "stop": null,
    "admitted": 7,
    "admittedBytes": 2238,
    "directories": 4,
    "ignored": {
      "vcs": 0,
      "dependencies": 0,
      "build-output": 0,
      "environment": 0,
      "gitignore": 0
    },
    "oversized": 0,
    "links": 0,
    "reparsePoints": 0,
    "special": 0,
    "notTraversed": 0,
    "uninspectable": 0,
    "unrepresentable": 0
  },
  "packageManager": {
    "name": "npm",
    "source": "package-manager-field",
    "declared": {
      "name": "npm",
      "version": "11.11.0"
    },
    "lockfile": {
      "path": "package-lock.json",
      "status": "not-parsed",
      "formatVersion": null
    },
    "ignoredLockfiles": []
  },
  "workspace": {
    "isWorkspace": true,
    "declarations": [
      "package.json"
    ],
    "releases": [
      "npm-11"
    ],
    "complete": false,
    "members": [
      "apps/site"
    ],
    "undetermined": [
      "apps/deep"
    ]
  },
  "packages": [
    {
      "directory": ".",
      "name": "fictional-deep-root",
      "manifest": "analyzed",
      "nextjs": {
        "verdict": "absent",
        "dependency": null,
        "version": null,
        "config": null,
        "router": "none",
        "app": null,
        "pages": null
      }
    },
    {
      "directory": "apps/site",
      "name": "fictional-site",
      "manifest": "analyzed",
      "nextjs": {
        "verdict": "nextjs",
        "dependency": {
          "field": "dependencies",
          "specifier": "^16.0.0"
        },
        "version": {
          "value": "16.0.0",
          "evidence": "lower-bound"
        },
        "config": {
          "path": "apps/site/next.config.mjs",
          "load": "loaded"
        },
        "router": "app",
        "app": {
          "path": "apps/site/app",
          "inSrc": false,
          "state": "directory",
          "routeFiles": 1,
          "complete": true
        },
        "pages": null
      }
    }
  ],
  "migrationPaths": [],
  "findings": [
    {
      "id": "F0001",
      "code": "FS2001",
      "severity": "unknown",
      "location": {
        "scope": "text",
        "path": "apps/deep/package.json",
        "start": {
          "offset": 319,
          "line": 4,
          "column": 268
        },
        "end": {
          "offset": 320,
          "line": 4,
          "column": 269
        }
      },
      "message": "Syntax error, file not analyzed",
      "explanation": "The file is not valid JSON (nesting exceeds the limit of 256 (json.max-depth) at bytes 319..320), so it is not analyzed.",
      "remediation": "Fix the syntax error, then run Frameshift again."
    },
    {
      "id": "F0002",
      "code": "FS2001",
      "severity": "unknown",
      "location": {
        "scope": "text",
        "path": "package-lock.json",
        "start": {
          "offset": 451,
          "line": 10,
          "column": 272
        },
        "end": {
          "offset": 452,
          "line": 10,
          "column": 273
        }
      },
      "message": "Syntax error, file not analyzed",
      "explanation": "The file is not valid JSON (nesting exceeds the limit of 256 (json.max-depth) at bytes 451..452), so it is not analyzed.",
      "remediation": "Fix the syntax error, then run Frameshift again."
    },
    {
      "id": "F0003",
      "code": "FS2001",
      "severity": "unknown",
      "location": {
        "scope": "text",
        "path": "pnpm-workspace.yaml",
        "start": {
          "offset": 174,
          "line": 4,
          "column": 145
        },
        "end": {
          "offset": 175,
          "line": 4,
          "column": 146
        }
      },
      "message": "Syntax error, file not analyzed",
      "explanation": "The file is not usable YAML (YAML collection nesting exceeds yaml.max-depth (implementation ceiling 128) at bytes 174..175), so it is not analyzed.",
      "remediation": "Fix the syntax error or raise the reported YAML limit, then run Frameshift again."
    },
    {
      "id": "F0004",
      "code": "FS1035",
      "severity": "review",
      "location": {
        "scope": "file",
        "path": "apps/deep"
      },
      "message": "Package manager rejects the workspace",
      "explanation": "The package.json of a workspace member is not valid, so the package manager fails to read the workspace. This holds for npm 11.",
      "remediation": "Correct the workspace so that the package manager installs it, then run Frameshift again."
    },
    {
      "id": "F0005",
      "code": "FS1042",
      "severity": "review",
      "location": {
        "scope": "file",
        "path": "apps/site/package.json"
      },
      "message": "Next.js version imprecise",
      "explanation": "No lockfile was read, so the Next.js version is the lowest version of the declared range, or unknown. If this package is a member of a workspace, run Frameshift on the workspace root and select the package.",
      "remediation": "Install the dependencies so that the lockfile resolves next, then run Frameshift again."
    },
    {
      "id": "F0006",
      "code": "FS1034",
      "severity": "review",
      "location": {
        "scope": "file",
        "path": "pnpm-workspace.yaml"
      },
      "message": "Workspace declaration of another package manager ignored",
      "explanation": "The detected package manager does not read this workspace declaration (pnpm reads only pnpm-workspace.yaml; npm, Yarn, and Bun read only the workspaces field of package.json), so it is not evaluated.",
      "remediation": "Remove the stale declaration, or correct the packageManager field."
    }
  ]
}
