{
  "kind": "frameshift.inspection",
  "schemaVersion": 1,
  "engineVersion": "@ENGINE_VERSION@",
  "files": {
    "complete": true,
    "stop": null,
    "admitted": 5,
    "admittedBytes": 376,
    "directories": 2,
    "ignored": {
      "vcs": 0,
      "dependencies": 0,
      "build-output": 0,
      "environment": 0,
      "gitignore": 0
    },
    "oversized": 0,
    "links": 0,
    "reparsePoints": 0,
    "special": 0,
    "notTraversed": 0,
    "uninspectable": 0,
    "unrepresentable": 0
  },
  "packageManager": {
    "name": null,
    "source": null,
    "declared": null,
    "lockfile": null,
    "ignoredLockfiles": []
  },
  "workspace": {
    "isWorkspace": false,
    "declarations": [],
    "releases": [],
    "complete": true,
    "members": [],
    "undetermined": []
  },
  "packages": [
    {
      "directory": ".",
      "name": "fictional-legacy",
      "manifest": "analyzed",
      "nextjs": {
        "verdict": "nextjs",
        "dependency": {
          "field": "dependencies",
          "specifier": "^13.5.0"
        },
        "version": {
          "value": "13.5.0",
          "evidence": "lower-bound"
        },
        "config": {
          "path": "next.config.cjs",
          "load": "unsupported"
        },
        "router": "pages",
        "app": null,
        "pages": {
          "path": "pages",
          "inSrc": false,
          "state": "directory",
          "routeFiles": 2,
          "complete": true
        }
      }
    }
  ],
  "migrationPaths": [],
  "findings": [
    {
      "id": "F0001",
      "code": "FS1043",
      "severity": "review",
      "location": {
        "scope": "file",
        "path": "next.config.cjs"
      },
      "message": "Next.js configuration file not loaded as expected",
      "explanation": "This Next.js version does not load a configuration file with this name: depending on the name and the version, it fails on the file or ignores it and uses its defaults.",
      "remediation": "Use next.config.js, next.config.mjs, or, from Next.js 15, next.config.ts."
    },
    {
      "id": "F0002",
      "code": "FS1041",
      "severity": "review",
      "location": {
        "scope": "file",
        "path": "package.json"
      },
      "message": "Next.js version outside the validated range",
      "explanation": "Frameshift V1 validates Next.js 14 to 16. This version is analyzed, and version-dependent rules behave conservatively.",
      "remediation": "Upgrade to a validated Next.js version, or review the results with extra care."
    },
    {
      "id": "F0003",
      "code": "FS1042",
      "severity": "review",
      "location": {
        "scope": "file",
        "path": "package.json"
      },
      "message": "Next.js version imprecise",
      "explanation": "No lockfile was read, so the Next.js version is the lowest version of the declared range, or unknown. If this package is a member of a workspace, run Frameshift on the workspace root and select the package.",
      "remediation": "Install the dependencies so that the lockfile resolves next, then run Frameshift again."
    }
  ]
}
