{
  "kind": "frameshift.inspection",
  "schemaVersion": 1,
  "engineVersion": "@ENGINE_VERSION@",
  "files": {
    "complete": true,
    "stop": null,
    "admitted": 6,
    "admittedBytes": 568,
    "directories": 4,
    "ignored": {
      "vcs": 0,
      "dependencies": 0,
      "build-output": 0,
      "environment": 0,
      "gitignore": 0
    },
    "oversized": 0,
    "links": 0,
    "reparsePoints": 0,
    "special": 0,
    "notTraversed": 0,
    "uninspectable": 0,
    "unrepresentable": 0
  },
  "packageManager": {
    "name": "npm",
    "source": "package-manager-field",
    "declared": {
      "name": "npm",
      "version": "11.11.0"
    },
    "lockfile": null,
    "ignoredLockfiles": []
  },
  "workspace": {
    "isWorkspace": true,
    "declarations": [
      "package.json"
    ],
    "releases": [
      "npm-11"
    ],
    "complete": true,
    "members": [
      "apps/del\u007f\u009b2J",
      "apps/\u202eevil\u061c"
    ],
    "undetermined": []
  },
  "packages": [
    {
      "directory": ".",
      "name": "fictional-\u001b[31mred\u001b[0m\nPackage        apps/fake (fictional-fake)",
      "manifest": "analyzed",
      "nextjs": {
        "verdict": "absent",
        "dependency": null,
        "version": null,
        "config": null,
        "router": "none",
        "app": null,
        "pages": null
      }
    },
    {
      "directory": "apps/del\u007f\u009b2J",
      "name": "fictional-del",
      "manifest": "analyzed",
      "nextjs": {
        "verdict": "inconclusive",
        "dependency": {
          "field": "devDependencies",
          "specifier": "^15.0.0"
        },
        "version": {
          "value": "15.0.0",
          "evidence": "lower-bound"
        },
        "config": null,
        "router": "none",
        "app": null,
        "pages": null
      }
    },
    {
      "directory": "apps/\u202eevil\u061c",
      "name": "fictional-\u2028line\u009b2J\\back\u202etxt.exe",
      "manifest": "analyzed",
      "nextjs": {
        "verdict": "nextjs",
        "dependency": {
          "field": "dependencies",
          "specifier": "^15.0.0"
        },
        "version": {
          "value": "15.0.0",
          "evidence": "lower-bound"
        },
        "config": {
          "path": "apps/\u202eevil\u061c/next.config.mjs",
          "load": "loaded"
        },
        "router": "app",
        "app": {
          "path": "apps/\u202eevil\u061c/app",
          "inSrc": false,
          "state": "directory",
          "routeFiles": 1,
          "complete": true
        },
        "pages": null
      }
    }
  ],
  "migrationPaths": [],
  "findings": [
    {
      "id": "F0001",
      "code": "FS1040",
      "severity": "review",
      "location": {
        "scope": "file",
        "path": "apps/del\u007f\u009b2J/package.json"
      },
      "message": "Next.js evidence incomplete",
      "explanation": "The package declares next, but has neither a next.config file nor route files in app or pages, so it is not classified as a Next.js project.",
      "remediation": "Check that the selected package is the Next.js application."
    },
    {
      "id": "F0002",
      "code": "FS1042",
      "severity": "review",
      "location": {
        "scope": "file",
        "path": "apps/\u202eevil\u061c/package.json"
      },
      "message": "Next.js version imprecise",
      "explanation": "No lockfile was read, so the Next.js version is the lowest version of the declared range, or unknown. If this package is a member of a workspace, run Frameshift on the workspace root and select the package.",
      "remediation": "Install the dependencies so that the lockfile resolves next, then run Frameshift again."
    }
  ]
}
